Journal,Title,Authors,Author_Information,Abstract,
66. Parasit Vectors. 2022 Apr 20;15(1):135. doi: 10.1186/s13071-022-05235-5.,"Systematic review to evaluate a potential association between helminth infection 
and physical stunting in children.","Raj E(1), Calvo-Urbano B(2)(3), Heffernan C(2)(4), Halder J(2)(3), Webster 
JP(5)(6).","Author information:
(1)Department of Pathobiology and Population Sciences, Royal Veterinary College, 
University of London, Hertfordshire, AL9 7TA, UK. eraj@rvc.ac.uk.
(2)Department of Pathobiology and Population Sciences, Royal Veterinary College, 
University of London, Hertfordshire, AL9 7TA, UK.
(3)London Centre for Neglected Tropical Disease Research, Imperial College 
Faculty of Medicine, W2 1PG, London, UK.
(4)London International Development Centre, London, WC1A 2NS, UK.
(5)Department of Pathobiology and Population Sciences, Royal Veterinary College, 
University of London, Hertfordshire, AL9 7TA, UK. jowebster@rvc.ac.uk.
(6)London Centre for Neglected Tropical Disease Research, Imperial College 
Faculty of Medicine, W2 1PG, London, UK. jowebster@rvc.ac.uk.","BACKGROUND: Despite considerable public health efforts over the past 20 years, 
childhood stunting (physical and/or cognitive) levels globally remain 
unacceptably high-at 22% amongst children under 5 years old in 2020. The 
aetiology of stunting is complex and still largely unknown. Helminths can cause 
significant mortality and morbidity and have often been cited as major causative 
agents for stunting, although their actual role in childhood stunting remains 
unclear. Our aim was to systematically review the current evidence to help 
support or refute the hypothesis that helminths cause physical stunting in 
children.
METHODS: Inclusion criteria were as follows: infected with (and/or exposed to) 
helminths (soil-transmitted helminths, schistosomes or food-borne trematodes), 
children, pregnant or breastfeeding women as study participants (children 
included infants 0-1 year old, preschool-age children 1-5 years and school-age 
children > 5 years old), anthelmintic treatment intervention, stunting-related 
variables reported (e.g. height, height-for-age z-score, birth weight), helminth 
infection reported in relation to stunting, any geographic location, any date, 
peer-reviewed literature only. Exclusion criteria were: non-primary research, 
study protocols, studies with no new data, non-English language papers and 
animal (non-human) helminth studies. Seven databases were searched on 28 May 
2021. Risk of bias was assessed for included studies and GRADE was used for 
studies included in RCT subgroup meta-analyses (in preschool-age children and 
pregnant women). This systematic review was registered with PROSPERO 
(CRD42021256201).
RESULTS: Eighty studies were included in the analyses. No significant overall 
evidence was found in support of the hypothesis that helminths cause physical 
stunting in children, although there was some association with wasting.
CONCLUSIONS: Whilst analyses of the available literature to date failed to 
support a direct association between helminth infection and childhood stunting, 
there was significant heterogeneity between studies, and many had follow-up 
periods which may have been too short to detect impacts on growth. Most apparent 
was a lack of available data from key demographic groups wherein one may predict 
the greatest association of helminth infection with stunting-notably that of 
infants, preschool-age children, and pregnant or nursing women. Thus this review 
highlights the urgent need for further targeted empirical research amongst these 
potentially most vulnerable demographic groups.",
67. JMIR Public Health Surveill. 2022 Apr 6;8(4):e33394. doi: 10.2196/33394.,"Influence of Maternal Exposure to Mass Media on Growth Stunting Among Children 
Under Five: Mediation Analysis Through the Water, Sanitation, and Hygiene 
Program.","Huo S(#)(1)(2), Wang K(#)(1), Liu Z(3), Yang Y(3), Hee JY(1), He Q(1), Takesue 
R(4), Tang K(1)(5).","Author information:
(1)Vanke School of Public Health, Tsinghua University, Beijing, China.
(2)Program in Public Health, University of California, Irvine, CA, United 
States.
(3)Department of Biostatistics, Mailman School of Public Health, Columbia 
University, New York, NY, United States.
(4)Health Section Programme Division, UNICEF Headquarters, New York, NY, United 
States.
(5)Institute of Healthy China, Tsinghua University, Beijing, China.
(#)Contributed equally","BACKGROUND: The issue of malnutrition in the Democratic Republic of Congo is 
severe. Meanwhile, the Water, Sanitation, and Hygiene program has been 
demonstrated to be effective in reducing the rates of growth stunting among 
children.
OBJECTIVE: We aimed to explore the association between maternal exposure to mass 
media and stunting in children through water, sanitation, and hygiene behaviors.
METHODS: Mediation analysis was conducted using data from the 2018 Multiple 
Indicators Cluster Surveys.
RESULTS: Mothers' exposures to television and the internet in the Democratic 
Republic of Congo significantly decreases the risk of stunting in children by 5% 
and 10%, respectively, mediated by household water, sanitation, and hygiene 
facilities and practices.
CONCLUSIONS: These findings could inform interventions and policies to reduce 
the rate of stunting rate children by promoting water, sanitation, and hygiene 
through mass media, especially through the internet and television.",
"68. Rural Remote Health. 2022 Mar;22(1):7082. doi: 10.22605/RRH7082. Epub 2022
Mar  21.","Determinants of socioeconomic and rural-urban disparities in stunting: evidence 
from Indonesia.","Widyaningsih V(1), Mulyaningsih T(2), Rahmawati FN(3), Adhitya D(4).","Author information:
(1)Public Health and Preventive Medicine, Faculty of Medicine, Universitas 
Sebelas Maret, Indonesia vitri_w@staff.uns.ac.id.
(2)Department of Economics, Faculty of Economics and Business, Universitas 
Sebelas Maret, Indonesia trimulyaningsih@staff.uns.ac.id.
(3)Department of Economics, Faculty of Economics and Business, Universitas 
Muhammadiyah Surakarta, Indonesia fitrie.rahma@gmail.com.
(4)Department of Economics, Faculty of Economics and Business, Universitas 
Kristen Satya Wacana, Indonesia dhian.adhitya@uksw.edu.","INTRODUCTION: Stunting continues to be a prominent health problem in Indonesia. 
Stunting prevalence is higher in children from poor families or living in rural 
areas; however, there has been a lack of information on predictors of stunting 
disparities and stunting risk factors by socioeconomic status (SES) and location 
of residence (rural or urban). This study aims to examine the factors associated 
with stunting by SES and rural-urban status, and to assess determinants of 
stunting disparities by SES and rural-urban status in Indonesia.
METHODS: This study analysed data from the Indonesian Family and Life Survey 
(IFLS) wave 5, conducted in 2014. Data for 3887 children aged 0-59 months, 
including individual, family and community variables, were analysed. Stratified 
logistic regression was conducted to assess differences in determinants of 
stunting by household expenditure (poor or non-poor, representing SES) and 
rural-urban status. The Oaxaca-Blinder decomposition method was used to assess 
determinants of stunting disparities by household expenditure and rural-urban 
status.
RESULTS: The analyses showed differences in factors associated with stunting 
among children in rural versus urban areas, or children in poor versus non-poor 
households. Mother's short stature and low education level increased the odds of 
stunting across all groups. However, in children of families with a higher 
household expenditure, unhealthy snacks were a significant predictor of stunting 
(adjusted odds ratio (aOR) 1.23, 95% confidence interval (CI) 1.04-1.47). This 
finding was not found in other groups. Good sanitation significantly reduced 
stunting in children in families with higher household expenditure and children 
from urban communities. Nutrition services were significantly associated with 
stunting in poor children and children from urban areas. The decomposition 
analyses showed that differences in characteristics explained 55.35% stunting 
disparity by household expenditure. Meanwhile, rural-urban disparity was mostly 
explained by differences in responses (56.20%), with low birth weight and 
unexplained variables as predominant contributors.
CONCLUSION: There were slight differences in stunting determinants by household 
expenditure and rural-urban status in Indonesia. Stunting disparities were 
attributed to differences in characteristics and responses between the less and 
more advantaged populations. To improve the effectiveness of stunting reduction 
programs, specific interventions tailored to address the differences between the 
more and less advantaged population are needed.",
"69. PLoS One. 2022 Mar 2;17(3):e0264010. doi: 10.1371/journal.pone.0264010. 
eCollection 2022.","Are early childhood stunting and catch-up growth associated with school age 
cognition?-Evidence from an Indian birth cohort.","Koshy B(1), Srinivasan M(2), Gopalakrishnan S(1), Mohan VR(3), Scharf R(4), 
Murray-Kolb L(5), John S(6), Beulah R(1), Muliyil J(2), Kang G(2).","Author information:
(1)Developmental Paediatrics Unit, Christian Medical College, Vellore, India.
(2)Wellcome research Unit, Christian Medical College, Vellore, India.
(3)Community Health, Christian Medical College, Vellore, India.
(4)University of Virginia Children's Hospital, Charlottesville, Virginia, United 
States of America.
(5)The Pennsylvania State University, State College, Pennsylvania, United States 
of America.
(6)Low Cost Effective Care Unit, Christian Medical College, Vellore, India.","BACKGROUND: Millions of children worldwide especially in the Asian subcontinent 
are vulnerable to early childhood stunting. There are contradictory reports of 
the association between catch-up growth in childhood and school age cognition.
METHODS: A community-based birth cohort recruited between 2010 and 2012 from 
urban slums in Vellore, India was followed up until 9 years of age. From regular 
anthropometric measurements, stunting status for each individual child was 
calculated at 2, 5 and 9 years. Cognition was assessed at 9 years of age using 
the Malin's Intelligence Scale for Indian Children (MISIC). Children were 
divided into groups based on stunting at each time point as well as catch-up 
growth, and a regression model was utilised to evaluate their association with 
cognition at 9 years.
RESULTS: Among 203 children included in this analysis, 94/203 (46.31%) children 
were stunted at 2 years of age, of whom 39.36% had a catch-up growth at 5 years 
of age, and 38.30% at 9 years. Around 10% of the cohort remained stunted at all 
time points. In the multivariable analysis, children who were stunted at 2, 5 
and 9 years had a significantly lower verbal and total intelligence quotient 
(IQ) scores by 4.6 points compared to those who were never stunted. Children 
with catch up growth following stunting at 2 years had higher cognition scores 
than those who were persistently stunted throughout the childhood.
CONCLUSIONS: This study showed persistent stunting in childhood was associated 
with lowering of 4-5 IQ points in childhood cognition at 9 years of age. 
Recovery from early life stunting in children with catch up growth prevented 
further lowering of cognition scores in these children compared to persistently 
stunted children. Nutritional supplementation during late infancy and early 
toddlerhood in addition to continuing nutritional supplementation programmes for 
preschool and school children can improve childhood stunting and cognitive 
abilities in vulnerable populations.",
70. BMC Public Health. 2022 Feb 11;22(1):285. doi: 10.1186/s12889-022-12690-3.,"Joint modelling of anaemia and stunting in children less than five years of age 
in Lesotho: a cross-sectional case study.","Gaston RT(1)(2), Habyarimana F(3), Ramroop S(3).","Author information:
(1)School of Mathematics, Statistics and Computer Sciences, University of 
KwaZulu-Natal, Private Bag X01, Pietermaritzburg CampusScottsville, 3209, South 
Africa. rugiratony@gmail.com.
(2)Health Economics and HIV/AIDS Research Division (HEARD), University of 
KwaZulu-Natal, Westville Campus, Private Bag X01, Westville, 3629, South Africa. 
rugiratony@gmail.com.
(3)School of Mathematics, Statistics and Computer Sciences, University of 
KwaZulu-Natal, Private Bag X01, Pietermaritzburg CampusScottsville, 3209, South 
Africa.","BACKGROUND: Anaemia and stunting remain jointly a serious health issue worldwide 
especially in developing countries. In Lesotho, their prevalence is high, 
particularly among children less than 5 years of age.
OBJECTIVES: The primary objective was to determine the association between 
anaemia and stunting, and identify factors relating to both conditions among 
children younger than 5 years in Lesotho.
METHODS: This cross-sectional study used secondary data from 3112 children 
collected during the 2014 Lesotho Demographic Health Survey (LDHS). Haemoglobin 
(Hb) levels were adjusted for altitude and a level less than 11 g per deciliters 
(11 g/dl) was determined as the cutoff for being anaemic. A child with the 
height-for-age z score (HAZ) below minus two standard deviations (SD) was 
considered to have stunting. We linked factors relating to anaemia and stunting 
using a multivariate joint model under the scope of the generalized linear mixed 
model (GLMM).
RESULTS: The prevalence of anaemia and stunting in children younger than 5 years 
were 51% and 43% respectively. The multivariate results revealed a strong 
association between anaemia and stunting. In addition, maternal education, urban 
vs. rural residence, wealth index and childbirth weight significantly impacted 
childhood stunting or malnutrition, while having fever and/or diarrhoea was 
linked to anaemia. Lastly, age was shown to have a significant effect on both 
stunting and anaemia.
CONCLUSION: Anaemia and stunting or malnutrition showed linked longitudinal 
trajectories, suggesting both conditions could lead to synergetic improvements 
in overall child health. Demographic, socio-economic, and geographical 
characteristics were also important drivers of stunting and anaemia in children 
younger than 5 years. Thus, children living in similar resources settings as 
Lesotho could benefit from coordinated programs designed to address both 
malnutrition and anaemia.",
71. BMC Public Health. 2022 Jan 24;22(1):159. doi: 10.1186/s12889-022-12552-y.,"Bayesian geostatistical modelling of stunting in Rwanda: risk factors and 
spatially explicit residual stunting burden.","Uwiringiyimana V(1)(2), Osei F(1), Amer S(3), Veldkamp A(1).","Author information:
(1)Faculty of Geo-Information Science and Earth Observation (ITC), University of 
Twente, P.O. Box 217, 7500 AE, Enschede, The Netherlands.
(2)Department of Food Science and Technology, College of Agriculture Animal 
Science and Veterinary Medicine, University of Rwanda, PO Box 3900, Kigali, 
Rwanda.
(3)Faculty of Geo-Information Science and Earth Observation (ITC), University of 
Twente, P.O. Box 217, 7500 AE, Enschede, The Netherlands. s.amer@utwente.nl.","BACKGROUND: Stunting remains a significant public health issue in Rwanda and its 
prevalence exhibits considerable geographical variation. We apply Bayesian 
geostatistical modelling to study the spatial pattern of stunting in children 
less than five years considering anthropometric, socioeconomic and demographic 
risk factors in Rwanda. In addition, we predict the spatial residuals effects to 
quantify the burden of stunting not accounted for by our geostatistical model.
METHODS: We used the data from the 2015 Rwanda Demographic and Health Survey. We 
fitted two spatial logistic models with similar structures, only differentiated 
by the inclusion or exclusion of spatially structured random effects.
RESULTS: The risk factors of stunting identified in the geostatistical model 
were being male (OR = 1.32, 95% CI: 1.16, 1.47), lower birthweight (kg) 
(OR = 0.96, 95% CI: 0.95, 0.97), non-exclusive breastfeeding (OR = 1.24, 95% CI: 
1.04, 1.45), occurrence of diarrhoea in the last two weeks (OR = 1.18, 95% CI: 
1.02, 1.37), a lower proportion of mothers with overweight (BMI ≥ 25) 
(OR = 0.82, 95% CI: 0.71, 0.95), a higher proportion of mothers with no or only 
primary education (OR = 1.14, 95% CI: 0.99, 1.36). Also, a higher probability of 
living in a house with poor flooring material (OR = 1.22, 95% CI: 1.06, 1.41), 
reliance on a non-improved water source (OR = 1.13, 95% CI: 1.00, 1.27), and a 
low wealth index were identified as risk factors of stunting. Mapping of the 
spatial residuals effects showed that, in particular, the Northern and Western 
regions, followed by the Southern region of Rwanda, still exhibit a higher risk 
of stunting even after accounting for all the covariates in the spatial model.
CONCLUSIONS: Further studies are needed to identify the still unknown spatially 
explicit factors associated with higher risk of stunting. Finally, given the 
spatial heterogeneity of stunting, interventions to reduce stunting should be 
geographically targeted.",
72. Int Health. 2022 Nov 1;14(6):639-647. doi: 10.1093/inthealth/ihab090.,"Exposure to household air pollution from solid cookfuels and childhood stunting: 
a population-based, cross-sectional study of half a million children in low- and 
middle-income countries.","Caleyachetty R(1)(2), Lufumpa N(3), Kumar N(4), Mohammed NI(5), Bekele H(6), 
Kurmi O(7)(8), Wells J(9), Manaseki-Holland S(3).","Author information:
(1)Nuffi eld Department of Medicine, University of Oxford, Oxford, OX3 7BN, UK.
(2)Warwick Medical School, University of Warwick, Coventry, CV4 7HL, UK.
(3)Institute of Applied Health Research, University of Birmingham, Birmingham, 
B15 2TT, UK.
(4)University College London Medical School, University College London, London, 
WC1E 6DE, UK.
(5)Medical Research Council Unit The Gambia at the London School of Hygiene 
&amp; Tropical Medicine, Atlantic Boulevard, Fajara, P.O. Box 273, Banjul, The 
Gambia.
(6)World Health Organization, Inter-Country Support Team, Zimbabwe WHO Country 
Office, Harare, Zimbabwe.
(7)Faculty of Health and Life Sciences, Coventry University, Coventry, CV1 5FB, 
UK.
(8)Department of Medicine, McMaster University, Hamilton, ON, L8S 4L8, Canada.
(9)Childhood Nutrition Research Centre, Population Policy and Practice Research 
and Teaching Department, UCL Great Ormond Street Institute of Child Health, 
London, WC1N 1EH, UK.","BACKGROUND: Household air pollution from the incomplete combustion of solid 
cookfuels in low- and middle-income countries (LMICs) has been largely ignored 
as a potentially important correlate of stunting. Our objective was to examine 
the association between solid cookfuel use and stunting in children aged &lt;5 
y.
METHODS: We used data from 59 LMICs' population-based cross-sectional 
demographic and health surveys; 557 098 children aged &lt;5 y were included in 
our analytical sample. Multilevel logistic regression was used to examine the 
association between exposure to solid cookfuel use and childhood stunting, 
adjusting for child sex, age, maternal education and number of children living 
in the household. We explored the association across key subgroups.
RESULTS: Solid cookfuel use was associated with child stunting (adjusted OR 
1.58, 95% CI 1.55 to 1.61). Children living in households using solid cookfuels 
were more likely to be stunted if they lived in rural areas, the poorest 
households, had a mother who smoked tobacco or were from the Americas.
CONCLUSIONS: Focused strategies to reduce solid cookfuel exposure might 
contribute to reductions in childhood stunting in LMICs. Trial evidence to 
assess the effect of reducing solid cookfuel exposure on childhood stunting is 
urgently needed.",
"73. J Glob Health. 2021 Dec 25;11:04070. doi: 10.7189/jogh.11.04070. eCollection 
2021.","The prevalence of stunting among children and adolescents living in the Middle 
East and North Africa region (MENA): A systematic review and meta-analysis.","Joulaei H(1), Keshani P(2), Ashourpour M(3), Bemani P(4), Amiri S(5), Rahimi 
J(6), Aliakbarpour M(1), Salehi-Abargouei A(7).","Author information:
(1)Shiraz HIV/AIDS Research Center, Institute of Health, Shiraz University of 
Medical Sciences, Shiraz, Iran.
(2)Health Policy Research Center, Institute of Health, Shiraz University of 
Medical Sciences, Shiraz, Iran.
(3)Department of Nutrition Sciences, School of Health, Larestan University of 
Medical Sciences, Larestan, Iran.Emam Reza Teaching Hospital, Larestan 
University of Medical Sciences, Larestan, Iran.
(4)Department of Immunology, School of Medicine, Isfahan University of Medical 
Sciences, Isfahan, Iran.
(5)Department of Epidemiology, Health School, Shiraz University of Medical 
Sciences, Shiraz, Iran.
(6)Department of Epidemiology and Biostatistics, School of Public Health, North 
Khorasan University of Medical Sciences, Bojnurd, Iran.
(7)Nutrition and Food Security Research Center, Department of nutrition, School 
of Public Health, Shahid Sadoughi University of Medical Sciences, Yazd, Iran.","BACKGROUND: Given the strategic importance of the MENA, the state of war and 
inequity in the region and its effect on malnutrition which leads to mortality 
and reduced economic development in this region, the current study purposed to 
examine the prevalence of stunting as an indicator of chronic malnutrition in 
the MENA region, with consideration given HDI, rural/urban area, and 
war-involved countries.
METHODS: The electronic databases of PubMed, SCOPUS, Web of science, and Embase 
were systematically searched, and English-language articles published between 
January 1, 2009 and December 31, 2019 were included in this study. The POLIS 
(population, outcome, location, indicator, study design) criteria were used to 
perform the systematic review, and studies involving children 2 to 18 years of 
age were selected.
RESULTS: Fifty-eight (n = 2 202 869) were included based on the study's 
inclusion criteria. The prevalence of stunting in children in the total MENA 
region was 22.0% (95% confidence interval (CI) = 20.4-23.6; I2  = 99.92%, 
P < 0.0001). The studies included in the meta-analysis were analyzed by 
subgroups. The pooled prevalence of stunting in children aged 2-5 years old and 
children aged 6 and older was 25.7% and 16.5%, respectively. The pooled 
prevalence of stunting was 34.1% in rural and 12.4% in urban areas. The pooled 
prevalence of stunting according to HDI was 30.1%, 28.5%, 13.1%, in low, medium, 
and high HDI countries, respectively. Furthermore, the pooled prevalence of 
stunting according to war status was 28.5% in war-involved countries vs 20.6% in 
others.
CONCLUSIONS: High prevalence of malnutrition was seen based on stunting 
indicator in the meta-analysis study in the MENA region, and this issue became 
more pronounced when the data was divided into subgroups based on age, 
residential area, and HDI. Inequality regarding social, economic, and political 
factors leads to significant malnutrition in the mentioned region.",
74. Nutrients. 2021 Nov 29;13(12):4312. doi: 10.3390/nu13124312.,"Trends of Stunting Prevalence and Its Associated Factors among Nigerian Children 
Aged 0-59 Months Residing in the Northern Nigeria, 2008-2018.","Ezeh OK(1), Abir T(1)(2), Zainol NR(3), Al Mamun A(4), Milton AH(5), Haque 
MR(6), Agho KE(1)(7).","Author information:
(1)School of Health Sciences, Western Sydney University, Locked Bag 1797, 
Penrith, NSW 2750, Australia.
(2)School of Business, Ahsanullah University of Science and Technology, Dhaka 
1208, Bangladesh.
(3)Faculty of Entrepreneurship and Business, University Malaysia Kelantan, Kota 
Bharu 16100, Malaysia.
(4)Faculty of Business and Management, UCSI University, Kuala Lumpur 56000, 
Malaysia.
(5)Epidemiology Resource Centre, Newcastle, NSW 2290, Australia.
(6)Department of Psychiatry, Sir Salimullah Medical College, Dhaka 1206, 
Bangladesh.
(7)Translational Health Research Institute (THRI), Campbelltown Campus, Western 
Sydney University, Penrith, NSW 2571, Australia.","Every year in Nigeria, malnutrition contributes to more than 33% of the deaths 
of children below 5 years, and these deaths mostly occur in the northern 
geopolitical zones (NGZs), where nearly 50% of all children below 5 years are 
stunted. This study examined the trends in the prevalence of stunting and its 
associated factors among children aged 0-23 months, 24-59 months and 0-59 months 
in the NGZs. The data of 33,682 recent live births in the NGZs, extracted from 
the Nigeria Demographic and Health Surveys from 2008 to 2018, were used to 
investigate the factors associated with stunting using multilevel logistic 
regression. Children aged 24-59 months reported the highest prevalence of 
stunting, with 53.3% (95% confidence interval: 52.0-54.6%). Multivariable 
analyses revealed four common factors that increased the odds of a child's 
stunting across all age subgroups: poor households, geopolitical zone (northwest 
or northeast), being a male and maternal height (<145 cm). Interventional 
strategies focused on poverty mitigation through cash transfer and educating low 
socioeconomic mothers on the benefits of gender-neutral supplementary feeding 
and the timely monitoring of the offspring of short mothers would substantially 
reduce stunting across all age subgroups in the NGZs.",
