Journal,Title,Authors,Author_Information,Abstract,
"193. Matern Child Health J. 2017 Mar;21(3):492-508. doi:
10.1007/s10995-016-2132-8.","Birth Size, Stunting and Recovery from Stunting in Andhra Pradesh, India: 
Evidence from the Young Lives Study.","Singh A(1), Upadhyay AK(2), Kumar K(3).","Author information:
(1)Department of Public Health and Mortality Studies, International Institute 
for Population Sciences, Govandi Station Road, Deonar, Mumbai, 400088, India. 
abhi_iips@yahoo.co.in.
(2)International Institute for Population Sciences, Govandi Station Road, 
Deonar, Mumbai, 400088, India.
(3)Department of Public Health and Mortality Studies, International Institute 
for Population Sciences, Govandi Station Road, Deonar, Mumbai, 400088, India.","Objectives Few Indian studies have examined the relationship between birth size 
and stunting in children. Studies on recovery from stunting in India are even 
fewer. This study, thus, investigates the relationship between birth size and 
stunting in Andhra Pradesh, India. This study further examines the factors 
associated with recovery from stunting using a longitudinal data. Methods We 
used data from the three waves of Young Lives Study (YLS) conducted in Andhra 
Pradesh in the years 2002, 2006-2007, and 2009 respectively. We used data from 
1965 children in wave 1 to examine the association between birth size and 
stunting. For examining the factors associated with recovery from stunting 
between 1 and 5 years of age, and between 5 and 8 years, we use data from 582 
and 670 children who were stunted at age 1 and age 5 respectively. We use 
multivariable logistic regression models to fulfil the objectives of the paper. 
Results The children who were of average- or large- size at birth were 
significantly less likely to be stunted than children who were of small size at 
birth (OR 0.61 and 0.47 respectively). Children of average/tall mothers were 
0.41 times less likely to be stunted than children of shorter mothers. Severely 
stunted children were less likely than other stunted children to recover from 
stunting between 1 and 5 years of age, and between 5 and 8 years. Mother's 
height was statistically associated with recovery. Change in wealth status of 
the household was statistically associated with recovery between 1 and 5 years 
of age. In comparison, child immunization was associated with recovery between 5 
and 8 years. Conclusions for Practice This study contributes to the 
understanding of the impact of birth size on childhood stunting, and to the 
extent of recovery from stunting in India. Further follow-up is necessary to 
demonstrate the impact during adolescence and adulthood.",
"194. Cien Saude Colet. 2016 Jun;21(7):2257-66. doi: 
10.1590/1413-81232015217.18602014.","Stunting in children under five years old is still a health problem in the 
Western Brazilian Amazon: a population-based study in Assis Brasil, Acre, 
Brazil.","Mantovani SA(1), Ramalho AA(1), Pereira TM(1), Branco FL(1), Oliart-Guzmán H(1), 
Delfino BM(1), Braña AM(1), Martins AC(1), Filgueira-Júnior JA(1), Santos AP(1), 
Campos RG(1), Guimarães AS(1), Araújo TS(1), Oliveira CS(1), Codeço CT(2), da 
Silva-Nunes M(1).","Author information:
(1)Centro de Ciências da Saúde, Universidade Federal do Acre. BR 364 km 04. 
69917-769 Rio Branco AC Brazil. msnunes1@ yahoo.com.br.
(2)Programa de Computação Científica, Fundação Oswaldo Cruz. Rio de Janeiro RJ 
Brazil.","Despite the process of nutritional transition in Brazil, in some places, such as 
the Amazon region, stunting is still an important public health problem. We 
identified the prevalence and factors associated with stunting in children under 
five years old residing in the urban area of Assis Brasil. A survey was 
conducted in which a questionnaire on socioeconomic, maternal and children's 
conditions was applied, and height or length was measured. The children with 
height for age index below -2 Z-scores were considered stunted, according to the 
criteria by the World Health Organization. Four hundred and twenty-eight 
children were evaluated. Of these, 62 were stunted. Factors associated with 
stunting, according to adjusted models, were: the presence of open sewer, the 
wealth index for households, the receipt of governmental financial aid and the 
mother's height, age and education. Therefore, it was observed that family and 
the mother's characteristics as well as environmental and socioeconomic factors 
were closely related to the occurrence of stunting in the population studied, 
and such nutritional disturbance is still a health problem in the Brazilian 
Amazon.",
"195. Am J Trop Med Hyg. 2016 Sep 7;95(3):694-701. doi: 10.4269/ajtmh.16-0098.
Epub  2016 Jun 27.","Fecal Markers of Environmental Enteropathy and Subsequent Growth in Bangladeshi 
Children.","Arndt MB(1), Richardson BA(2), Ahmed T(3), Mahfuz M(3), Haque R(4), John-Stewart 
GC(5), Denno DM(6), Petri WA Jr(7), Kosek M(8), Walson JL; in coordination with 
the MAL-ED Network Project.","Author information:
(1)Department of Epidemiology, University of Washington, Seattle, Washington. 
marndt@uw.edu.
(2)Department of Biostatistics, University of Washington, Seattle, Washington. 
Department of Global Health, University of Washington, Seattle, Washington.
(3)Nutrition and Clinical Services Division, International Centre for Diarrhoeal 
Disease Research, Bangladesh (icddr,b), Dhaka, Bangladesh.
(4)Parasitology Laboratory, International Centre for Diarrhoeal Disease 
Research, Bangladesh (icddr,b), Dhaka, Bangladesh.
(5)Department of Epidemiology, University of Washington, Seattle, Washington. 
Department of Global Health, University of Washington, Seattle, Washington. 
Department of Medicine, University of Washington, Seattle, Washington. 
Department of Pediatrics, University of Washington, Seattle, Washington.
(6)Department of Global Health, University of Washington, Seattle, Washington. 
Department of Pediatrics, University of Washington, Seattle, Washington. 
Nutrition and Clinical Services Division, International Centre for Diarrhoeal 
Disease Research, Bangladesh (icddr,b), Dhaka, Bangladesh.
(7)Division of Infectious Diseases and International Health, Department of 
Medicine, University of Virginia, Charlottesville, Virginia.
(8)Department of International Health, Johns Hopkins University Bloomberg School 
of Public Health, Baltimore, Maryland. Asociación Benéfica Proyectos de 
Informática, Salud, Medicina, y Agricultura (PRISMA), Lima, Peru.","Environmental enteropathy (EE), a subclinical intestinal disorder characterized 
by mucosal inflammation, reduced barrier integrity, and malabsorption, appears 
to be associated with increased risk of stunting in children in low- and 
middle-income countries. Fecal biomarkers indicative of EE (neopterin [NEO], 
myeloperoxidase [MPO], and alpha-1-antitrypsin [AAT]) have been negatively 
associated with 6-month linear growth. Associations between fecal markers (NEO, 
MPO, and AAT) and short-term linear growth were examined in a birth cohort of 
246 children in Bangladesh. Marker concentrations were categorized in stool 
samples based on their distribution (< first quartile, interquartile range, > 
third quartile), and a 10-point composite EE score was calculated. Piecewise 
linear mixed-effects models were used to examine the association between markers 
measured quarterly (in months 3-21, 3-9, and 12-21) and 3-month change in 
length-for-age z-score (ΔLAZ). Children with high MPO levels at quarterly time 
points lost significantly more LAZ per 3-month period during the second year of 
life than those with low MPO (ΔLAZ = -0.100; 95% confidence interval = -0.167 to 
-0.032). AAT and NEO were not associated with growth; however, composite EE 
score was negatively associated with subsequent 3-month growth. In this cohort 
of children from an urban setting in Bangladesh, elevated MPO levels, but not 
NEO or AAT levels, were associated with decreases in short-term linear growth 
during the second year of life, supporting previous data suggesting the 
relevance of MPO as a marker of EE.",
"196. Clin Infect Dis. 2016 Sep 15;63(6):792-7. doi: 10.1093/cid/ciw391. Epub 2016
Jun  16.","A Prospective Longitudinal Cohort to Investigate the Effects of Early Life 
Giardiasis on Growth and All Cause Diarrhea.","Donowitz JR(1), Alam M(2), Kabir M(2), Ma JZ(3), Nazib F(4), Platts-Mills JA(5), 
Bartelt LA(6), Haque R(2), Petri WA Jr(5).","Author information:
(1)Division of Pediatric Infectious Diseases, Children's Hospital of Richmond at 
Virginia Commonwealth University.
(2)Parasitology Laboratory, International Centre for Diarrhoeal Disease 
Research, Bangladesh, Dhaka.
(3)Department of Public Health Sciences, University of Virginia, 
Charlottesville.
(4)Department of Medicine and Vaccine Testing Center, The University of Vermont 
College of Medicine, Burlington.
(5)Division of Infectious Diseases and International Health, University of 
Virginia, Charlottesville.
(6)Division of Infectious Diseases, University of North Carolina-Chapel Hill.","BACKGROUND: Growth stunting in children under 2 years of age in low-income 
countries is common. Giardia is a ubiquitous pathogen in this age group but 
studies investigating Giardia's effect on both growth and diarrhea have produced 
conflicting results.
METHODS: We conducted a prospective longitudinal birth cohort study in Dhaka, 
Bangladesh, with monthly Giardia and continuous diarrheal surveillance.
RESULTS: 629 children were enrolled within the first 72 hours of life, and 445 
completed 2 years of the study. 12% of children were stunted at birth with 57% 
stunted by 2 years. 7% of children had a Giardia positive surveillance stool in 
the first 6 months of life, whereas 74% had a positive stool by 2 years. The 
median time to first Giardia positive surveillance stool was 17 months. Presence 
of Giardia in a monthly surveillance stool within the first 6 months of life 
decreased length-for-age Z score at 2 years by 0.4 (95% confidence interval, 
-.80 to -.001; P value .05) whereas total number of Giardia positive months over 
the 2-year period of observation did not. Neither variable was associated with 
weight-for-age Z score at 2 years. In our model to examine predictors of 
diarrhea only exclusive breastfeeding was significantly associated with 
decreased diarrhea (P value <.001). Concomitant giardiasis was neither a risk 
factor nor protective.
CONCLUSIONS: Early life Giardia was a risk factor for stunting at age 2 but not 
poor weight gain. Presence of Giardia neither increased nor decreased odds of 
acute all cause diarrhea.",
"197. Matern Child Health J. 2016 Oct;20(10):2037-49. doi:
10.1007/s10995-016-2023-z.","Undernutrition Among Infants and Children in Nepal: Maternal Health Services and 
Their Roles to Prevent it.","Pokhrel K(1), Nanishi K(2), Poudel KC(3), Pokhrel KG(4), Tiwari K(5), Jimba 
M(1).","Author information:
(1)Department of Community and Global Health, Graduate School of Medicine, The 
University of Tokyo, Tokyo, Japan.
(2)Department of Community and Global Health, Graduate School of Medicine, The 
University of Tokyo, Tokyo, Japan. keikonanishi@yahoo.co.jp.
(3)Department of Public Health, School of Public Health and Health Sciences, 
University of Massachusetts Amherst, Amherst, MA, USA.
(4)Integrated Development Foundation, Teku, Kathmandu, Nepal.
(5)Nepali Technical Assistance Group, Maitighar, Kathmandu, Nepal.","Objectives Appropriate infant and young child feeding (IYCF) for children aged 
6-23 months includes adequate dietary diversity, appropriate meal frequency, and 
continued breastfeeding. Mothers receiving antenatal care (ANC) and postnatal 
care (PNC) may adopt better IYCF. This study examined the association of ANC or 
PNC attendance with IYCF and child nutrition status. Methods A cross-sectional 
study was performed on 400 mother-child pairs in rural Nepal. Mothers were 
interviewed about their history of ANC and PNC attendance and IYCF; the height 
and weight of their children were measured. IYCF was measured with infant and 
child feeding index (ICFI) aggregating scores of dietary diversity, meal 
frequency, continued breastfeeding, and dietary variety. Lower ICFI scores 
indicated poorer IYCF practices. Multiple regression and logistic regression 
examined the association of ANC and PNC attendance with ICFI scores and 
undernutrition, respectively. Results Absence of ANC (β = -1.01, P = 0.011) and 
absence of PNC (β = -1.01, P = 0.011) were negatively associated with ICFI 
scores. Additionally, absence of ANC was positively associated with underweight 
(AOR 3.37; 95 % CI 1.42-9.92 for children 6-11 months, AOR 3.43; 95 % CI 
1.41-8.32 for children 12-23 months) and stunting (AOR 6.51; 95 % CI 2.11-20.10 
for children 6-11 months, AOR 3.32; 95 % CI 1.50-7.31 for children 
12-23 months). Similarly, children tended to be underweight and stunted if their 
mothers did not receive any PNC. Conclusion Absence of ANC and PNC were 
associated with poor IYCF, underweight, and stunting in children.",
"198. Matern Child Nutr. 2016 May;12 Suppl 1(Suppl 1):121-40. doi:
10.1111/mcn.12259.","Determinants of stunting and poor linear growth in children under 2 years of age 
in India: an in-depth analysis of Maharashtra's comprehensive nutrition survey.","Aguayo VM(1), Nair R(2), Badgaiyan N(1), Krishna V(3).","Author information:
(1)United Nations Children's Fund (UNICEF) Regional Office for South Asia, 
Kathmandu, Nepal.
(2)UNICEF Field Office for Maharashtra, Mumbai, Maharashtra, India.
(3)Maharashtra Nutrition Mission, Ministry of Women and Child Development, 
Mumbai, Maharashtra, India.","We use a representative sample of 2561 children 0-23 months old to identify the 
factors most significantly associated with child stunting in the state of 
Maharashtra, India. We find that 22.7% of children were stunted, with one-third 
(7.4%) of the stunted children severely stunted. Multivariate regression 
analyses indicate that children born with low birthweight had a 2.5-fold higher 
odds of being stunted [odds ratio (OR) 2.49; 95% confidence interval (CI) 
1.96-3.27]; children 6-23 months old who were not fed a minimum number of 
times/day had a 63% higher odds of being stunted (OR 1.63; 95% CI 1.24-2.14); 
and lower consumption of eggs was associated with a two-fold increased odds of 
stunting in children 6-23 months old (OR 2.07; 95% CI 1.19-3.61); children whose 
mother's height was < 145 cm, had two-fold higher odds of being stunted (OR 
2.04; 95% CI 1.46-2.81); lastly, children of households without access to 
improved sanitation had 88% higher odds of being severely stunted (OR 1.88; 95% 
CI 1.17-3.02). Attained linear growth (height-for-age z-score) was significantly 
lower in children from households without access to improved sanitation, 
children of mothers without access to electronic media, without decision making 
power regarding food or whose height was < 145 cm, children born with a low 
birthweight and children 6-23 months old who were not fed dairy products, fruits 
and vegetables. In Maharashtra children's birthweight and feeding practices, 
women's nutrition and status and household sanitation and poverty are the most 
significant predictors of stunting and poor linear growth in children under 
2 years. Key messages One in five (22.7%) of children 0-23 months old in the 
state of Maharashtra were stunted, and one-third (7.4%) of the stunted children 
were severely stunted. Birthweight, child feeding, women's nutrition and 
household sanitation were the most significant predictors of stunting and poor 
linear growth in children under 2 years. Children born to mothers whose height 
was below 145 cm, had two-fold higher odds of being stunted; children born with 
a low birthweight had a 2.5-fold higher odds of being stunted. Low feeding 
frequency and low consumption of eggs, dairy products, fruits and vegetables 
were associated with stunting and poor linear growth in children 6-23 months 
old. Children of households without access to improved sanitation had 88% higher 
odds of being severely stunted.",
"199. Bull World Health Organ. 2016 May 1;94(5):331-9. doi: 10.2471/BLT.15.152462.
 Epub 2016 May 2.","Association between intimate partner violence and poor child growth: results 
from 42 demographic and health surveys.","Chai J(1), Fink G(1), Kaaya S(2), Danaei G(1), Fawzi W(1), Ezzati M(3), Lienert 
J(1), Smith Fawzi MC(4).","Author information:
(1)Harvard School of Public Health, Department of Global Health and Population, 
1633 Tremont Street, Boston, MA 02120, United States of America (USA).
(2)Muhimbili University of Health and Allied Sciences, Dar es Salaam, United 
Republic of Tanzania .
(3)Imperial College London, London, England .
(4)Harvard Medical School, Boston, USA .","OBJECTIVE: To determine the impact of intimate partner violence against women on 
children's growth and nutritional status in low- and middle-income countries.
METHODS: We pooled records from 42 demographic and health surveys in 29 
countries. Data on maternal lifetime exposure to physical or sexual violence by 
an intimate partner, socioeconomic and demographic characteristics were 
collected. We used logistic regression models to determine the association 
between intimate partner violence and child stunting and wasting.
FINDINGS: Prior exposure to intimate partner violence was reported by 69 652 
(34.1%) of the 204 159 ever-married women included in our analysis. After 
adjusting for a range of characteristics, stunting in children was found to be 
positively associated with maternal lifetime exposure to only physical (adjusted 
odds ratio, aOR: 1.11; 95% confidence interval, CI: 1.09-1.14) or sexual 
intimate partner violence (aOR: 1.09; 95% CI: 1.05-1.13) and to both forms of 
such violence (aOR: 1.10; 95% CI: 1.05-1.14). The associations between stunting 
and intimate partner violence were stronger in urban areas than in rural ones, 
for mothers who had low levels of education than for women with higher levels of 
education, and in middle-income countries than in low-income countries. We also 
found a small negative association between wasting and intimate partner violence 
(aOR: 0.94; 95%CI: 0.90-0.98).
CONCLUSION: Intimate partner violence against women remains common in low- and 
middle-income countries and is highly detrimental to women and to the growth of 
the affected women's children. Policy and programme efforts are needed to reduce 
the prevalence and impact of such violence.",
200. BMC Pediatr. 2016 Apr 15;16:49. doi: 10.1186/s12887-016-0587-9.,"Exploring spatial variations and factors associated with childhood stunting in 
Ethiopia: spatial and multilevel analysis.","Haile D(1), Azage M(2), Mola T(3), Rainey R(4).","Author information:
(1)Department of Public Health, College of Medicine and Health Sciences, Bahir 
Dar University, P.O. Box 79, Bahir Dar, Ethiopia.
(2)Department of Public Health, College of Medicine and Health Sciences, Bahir 
Dar University, P.O. Box 79, Bahir Dar, Ethiopia. mulukenag@yahoo.com.
(3)Department of Geography and Environmental Studies, Bahir Dar University, P.O. 
Box 79, Bahir Dar, Ethiopia.
(4)United States Agency for International Development (USAID), Washington, DC, 
USA.","BACKGROUND: Stunting reflects a failure to receive adequate nutrition over a 
long period of time. Stunting is associated with adverse functional consequences 
including poor cognition, low educational performance, low adult wages, and poor 
reproductive outcomes. The objective of the study was to investigate spatial 
variations and factors associated with childhood stunting in Ethiopia.
METHODS: This study is a secondary data analysis of the 2011 Ethiopian 
Demographic and Health Survey (EDHS). A total of 9893 children aged 0-59 months 
were included in the analysis. The Getis-Ord spatial statistical tool was used 
to identify high and low hotspots areas of stunting. A multilevel multivariable 
logistic regression was used to identify factors associated with stunting.
RESULTS: Statistically significant hotspots of stunting were found in northern 
parts of the country whereas low hotspots where there was less stunting than 
expected were found in the central, eastern, and western parts of the country. 
In the final model of multilevel logistic regression analysis, individual and 
community level factors accounted for 36.6 % of childhood stunting. Short birth 
interval [AOR = 1.68; 95%CI: (1.46-1.93)], being male [AOR = 1.20; 95%CI: 
(1.08-1.33)], and being from a male-headed household [AOR = 1.18; 95 % CI: 
(1.01-1.38)] were the factors that increased the odds of stunting at the 
individual level. Children in the age group between 24-35 months were more 
likely to be stunted than children whose age was less than one year [AOR = 6.61; 
95 % CI: (5.17-8.44)]. The odds of stunting among children with severe anemia 
were higher than children with no anemia [AOR = 3.23; 95%CI: (2.35-4.43)]. 
Children with mothers who had completed higher education had lower odds of being 
stunted compared to children whose mothers had no formal education [AOR = 0.42; 
95%CI: (0.18-0.94)]. The odds of being stunted were lower among children whose 
fathers completed higher education [AOR = 0.58; 95%CI: (0.38-0.89)] compared to 
children whose fathers had no formal education. Children whose mothers who had 
high a Body Mass Index (BMI) (≥25.0 kg/m(2)) were less likely to be stunted 
compared with children whose mothers had a normal BMI 
(18.5 kg/m(2)-24.9 kg/m(2))[AOR = 0.69; 95%CI: (0.52-0.90)]. Children from the 
poorest wealth quintile had higher odds of being stunted compared to children 
from the richest wealth quintiles [AOR = 1.43; 95 % CI: (1.08-1.88)]. 
Unavailability of improved latrine facilities and living in the northern parts 
of the country (Tigray, Affar, Amhara and Benishangul-Gumuzregions) were factors 
associated with higher odds of stunting from the community-level factors.
CONCLUSION: Stunting in children under five years old is not random in Ethiopia, 
with hotspots of higher stunting in the northern part of Ethiopia. Both 
individual and community-level factors were significant determinants of 
childhood stunting. The regions with high hotspots of child stunting should be 
targeted with additional resources, and the identified factors should be 
considered for nutritional interventions.",
"201. Vaccine. 2016 Apr 29;34(20):2312-20. doi: 10.1016/j.vaccine.2016.03.066.
Epub  2016 Mar 29.","Stunting correlates with high salivary and serum antibody levels after 13-valent 
pneumococcal conjugate vaccination of Venezuelan Amerindian children.","Verhagen LM(1), Hermsen M(2), Rivera-Olivero I(3), Sisco MC(3), Pinelli E(4), 
Hermans PW(5), Berbers GA(4), de Waard JH(3), de Jonge MI(5).","Author information:
(1)Laboratorio de Tuberculosis, Instituto de Biomedicina, Universidad Central de 
Venezuela, Caracas, Venezuela; Laboratory of Pediatric Infectious Diseases, 
Department of Pediatrics, Radboud Institute for Molecular Life Sciences, Radboud 
University Medical Center, Nijmegen, The Netherlands; Wilhelmina Children's 
Hospital, Utrecht, The Netherlands. Electronic address: 
L.M.Verhagen-4@umcutrecht.nl.
(2)Department of Pathology, Radboud University Nijmegen Medical Center, 
Nijmegen, The Netherlands.
(3)Laboratorio de Tuberculosis, Instituto de Biomedicina, Universidad Central de 
Venezuela, Caracas, Venezuela.
(4)Center for Infectious Disease Control, National Institute of Public Health 
and the Environment, The Netherlands.
(5)Laboratory of Pediatric Infectious Diseases, Department of Pediatrics, 
Radboud Institute for Molecular Life Sciences, Radboud University Medical 
Center, Nijmegen, The Netherlands.","OBJECTIVE: To determine the impact of pre-vaccination nutritional status on 
vaccine responses in Venezuelan Warao Amerindian children vaccinated with the 
13-valent pneumococcal conjugate vaccine (PCV13) and to investigate whether 
saliva can be used as read-out for these vaccine responses.
METHODS: A cross-sectional cohort of 504 Venezuelan Warao children aged 6 weeks 
- 59 months residing in nine geographically isolated Warao communities were 
vaccinated with a primary series of PCV13 according to Centers for Disease 
Control and Prevention (CDC)-recommended age-related schedules. Post-vaccination 
antibody concentrations in serum and saliva of 411 children were measured by 
multiplex immunoassay. The influence of malnutrition present upon vaccination on 
post-vaccination antibody levels was assessed by univariate and multivariable 
generalized estimating equations linear regression analysis.
RESULTS: In both stunted (38%) and non-stunted (62%) children, salivary antibody 
concentrations correlated well with serum levels for all serotypes with 
coefficients varying from 0.61 for serotype 3-0.80 for serotypes 5, 6A and 23F 
(all p < 0.01). Surprisingly, higher serum and salivary antibody levels were 
observed with increasing levels of stunting in children for all serotypes. This 
was statistically significant for 5/13 and 11/13 serotype-specific serum and 
saliva IgG concentrations respectively.
CONCLUSION: Stunted Amerindian children showed generally higher antibody 
concentrations than well-nourished children following PCV13 vaccination, 
indicating that chronic malnutrition influences vaccine response. Saliva samples 
might be useful to monitor serotype-specific antibody levels induced by PCV 
vaccination. This would greatly facilitate studies of vaccine efficacy in rural 
settings, since participant resistance generally hampers blood drawing.",
