Journal,Title,Authors,Author_Information,Abstract,
"132. Rural Remote Health. 2020 Jan;20(1):5214. doi: 10.22605/RRH5214. Epub 2020
Jan  15.","Distribution of child health indicators according to internal migration and 
various social variables in Turkey.","Santas G(1), Eryurt MA(2).","Author information:
(1)Health Management, Yozgat Bozok University, Turkey 
gulcan.santas@bozok.edu.tr.
(2)Hacettepe University Institute of Population Studies, Ankara, Turkey 
maeryurt@hacettepe.edu.tr.","INTRODUCTION: Birth weight, stunting and overweight/obesity of children are 
among the most important child health indicators that cause concerns all over 
the world. Based on international literature findings, birth weight, stunting 
and overweight/obesity of children may differ according to the various 
sociodemographic and socioeconomic factors. In addition, migration status of 
women and their children (within urban areas, within rural areas, urban to rural 
and rural to urban) may influence the birth outcomes and health status of 
children aged less than 5 years. The aim of this study is to determine the 
distribution of internal migration and the sociodemographic and socioeconomic 
factors on birth weight, stunting and overweight/obesity in children aged less 
than 5 years in Turkey. Another purpose of this study is to investigate the 
course of birth weight, stunting and overweight/obesity in children between 1993 
and 2013 in Turkey.
METHODS: The source of data for this study was the nationally representative 
five Turkey Demographic and Health Surveys (1993, 1998, 2003, 2008, 2013 TNSA). 
Surveys were conducted by Hacettepe University Institute of Population Studies. 
Logistic regression analysis was used in order to determine the impact of 
migration status, sociodemographic and socioeconomic factors on birth weight, 
stunting and overweight/obesity of children.
RESULTS: Compared to children living in urban areas, inadequate birth weight was 
found to be higher in children living in rual areas and in children who had 
migrated from urban areas to rural areas. Stunting was found to be higher in 
rural areas and urban to rural areas compared to urban areas. Unlike birth 
weight and stunting in children, overweight/obesity was higher in children 
living in urban areas compared to children living in rural areas. Moreover, it 
was revealed that sociodemographic factors (maternal education, birth order, 
receiving prenatal care, age, gender) and socioeconomic factors (residential 
area and childhood residential area) affected the birth weight, stunting and 
overweight/obesity of children in this study.
CONCLUSION: There is a need for policymakers to take steps to overcome the 
regional disparities that create disadvantages for children aged less than 5 
years in disadvantaged areas.",
133. Int Health. 2022 Jul 1;14(4):381-389. doi: 10.1093/inthealth/ihz105.,"Household structure, maternal characteristics and children's stunting in 
sub-Saharan Africa: evidence from 35 countries.","Yaya S(1)(2), Oladimeji O(3)(4)(5), Odusina EK(6), Bishwajit G(1).","Author information:
(1)School of International Development and Global Studies, Faculty of Social 
Sciences, University of Ottawa, Ottawa, Ontario, Canada.
(2)The George Institute for Global Health, The University of Oxford, Oxford, 
United Kingdom.
(3)Surveillance and Strategic Information Unit, Social Aspect of Public Health, 
Human Sciences Research Council, South Africa.
(4)School of Public Health, Faculty of Health Sciences, University of Namibia, 
Namibia.
(5)Department of Public Health, Walter Sisulu University, Eastern Cape, South 
Africa.
(6)Department of Demography and Social Statistics, Federal University, Oye 
Ekiti, Nigeria.","BACKGROUND: Adequate nutrition in early childhood is a necessity to achieve 
healthy growth and development, as well as a strong immune system and good 
cognitive development. The period from conception to infancy is especially vital 
for optimal physical growth, health and development. In this study we examined 
the influence of household structure on stunting in children <5 yrs of age in 
sub-Saharan Africa (SSA) countries.
METHODS: Demographic and Health Survey data from birth histories in 35 SSA 
countries were used in this study. The total sample of children born within the 
5 yrs before the surveys (2008 and 2018) was 384 928. Children whose 
height-for-age z-score throughout was <-2 SDs from the median of the WHO 
reference population were considered stunted. Percentages and χ2 tests were used 
to explore prevalence and bivariate associations of stunting. In addition, a 
multivariable logistic regression model was fitted to stunted children. All 
statistical tests were conducted at a p<0.05 level of significance.
RESULTS: More than one-third of children in SSA countries were reportedly 
stunted. The leading countries include Burundi (55.9%), Madagascar (50.1%), 
Niger (43.9%) and the Democratic Republic of the Congo (42.7%). The percentage 
of stunted children was higher among males than females and among rural children 
than their urban counterparts in SSA countries. Children from polygamous 
families and from mothers who had been in multiple unions had a 5% increase in 
stunting compared with children from monogamous families and mothers who had 
only one union (AOR 1.05 [95% CI 1.02 to 1.09]). Furthermore, rural children 
were 1.23 times as likely to be stunted compared with urban children (AOR 1.23 
[95% CI 1.16 to 1.29]). Children having a <24-mo preceding birth interval were 
1.32 times as likely to be stunted compared with first births (AOR 1.32 [95% CI 
1.26 to 1.38]). In addition, there was a 2% increase in stunted children for 
every unit increase in the age (mo) of children (AOR 1.02 [95% CI 1.01 to 
1.02]). Multiple-birth children were 2.09 times as likely to be stunted compared 
with a singleton (AOR 2.09 [95% CI 1.91 to 2.28]).
CONCLUSIONS: The study revealed that more than one-third of children were 
stunted in SSA countries. Risk factors for childhood stunting were also 
identified. Effective interventions targeting factors associated with childhood 
stunting, such as maternal education, advanced maternal age, male sex, child's 
age, longer birth interval, multiple-birth polygamy, improved household wealth 
and history of mothers' involvement in multiple unions, are required to reduce 
childhood stunting in the region.",
134. Salud Publica Mex. 2019 Nov-Dic;61(6):833-840. doi: 10.21149/10642.,"Stunting in children population in localities under 100 000 inhabitants in 
Mexico",[Article in Spanish; Abstract available in Spanish from the publisher],"Cuevas-Nasu L(1), Gaona-Pineda EB(1), Rodríguez-Ramírez S(2), Morales-Ruán 
MDC(1), González-Castell LD(2), García-Feregrino R(1), Gómez-Acosta LM(1), 
Ávila-Arcos MA(1), Shamah-Levy T(1), Rivera-Dommarco J(3).","OBJECTIVE: To describe the undernutrition prevalence, as well as some 
sociodemographic characteristics associated to stunting in children under five 
years old, living on locali- ties with less than 100 000 inhabitants in Mexico 
in 2012 and 2018.
MATERIALS AND METHODS: Low weight, stunting and wasting prevalences were 
calculated in children under 5y according to WHO Growth Reference. A comparison 
of stunting by sociodemographic and diet diversity variables is presented. 
Multi-variated logistic models between chronic malnutrition and sociodemographic 
variables were calculated.
RESULTS: In 2018, 4.4% of the individuals suffered low weight, 14.9% stunting 
and 1.5 % wasting. Stunting was greater in indigenous households (24.5%), 
households from the lower socioeconomic-index tertile (17.5%), and households 
with moderated/severe food insecurity (15.3%). Stunting was positively 
associated with indigenous condition; on the other hand a highly diverse diet 
resulted to be a protective factor against it.
CONCLUSIONS: A high prevalence of chronical malnutrition was documented 
associated with high poverty conditions. It is important to enforce strategies 
aimed to contain it, mainlyin such populations with greater social deprivation.",
"135. BMJ Glob Health. 2019 Nov 7;4(6):e001801. doi: 10.1136/bmjgh-2019-001801. 
eCollection 2019.","The Stunting Tool for Early Prevention: development and external validation of a 
novel tool to predict risk of stunting in children at 3 years of age.","Hanieh S(#)(1), Braat S(#)(2), Simpson JA(2), Ha TTT(3), Tran TD(3)(4), Tuan 
T(3), Fisher J(4), Biggs BA(1)(5).","Author information:
(1)Medicine at the Peter Doherty Institute for Infection and Immunity, 
University of Melbourne, Melbourne, Victoria, Australia.
(2)Centre for Epidemiology and Biostatistics, Melbourne School of Population and 
Global Health, University of Melbourne, Melbourne, Victoria, Australia.
(3)Research and Training Centre for Community Development, Hanoi, Vietnam.
(4)School of Public Health and Preventive Medicine, Monash University, 
Melbourne, Victoria, Australia.
(5)The Victorian Infectious Diseases Service, Royal Melbourne Hospital, 
Melbourne, Victoria, Australia.
(#)Contributed equally","Introduction: Globally, an estimated 151 million children under 5 years of age still suffer from the adverse effects of stunting. We sought to develop and externally validate an early life predictive model that could be applied in infancy to accurately predict risk of stunting in preschool children.

Methods: We conducted two separate prospective cohort studies in Vietnam that intensively monitored children from early pregnancy until 3 years of age. They included 1168 and 475 live-born infants for model development and validation, respectively. Logistic regression on child stunting at 3 years of age was performed for model development, and the predicted probabilities for stunting were used to evaluate the performance of this model in the validation data set.

Results: Stunting prevalence was 16.9% (172 of 1015) in the development data set and 16.4% (70 of 426) in the validation data set. Key predictors included in the final model were paternal and maternal height, maternal weekly weight gain during pregnancy, infant sex, gestational age at birth, and infant weight and length at 6 months of age. The area under the receiver operating characteristic curve in the validation data set was 0.85 (95% Confidence Interval, 0.80-0.90).

Conclusion: This tool applied to infants at 6 months of age provided valid prediction of risk of stunting at 3 years of age using a readily available set of parental and infant measures. Further research is required to examine the impact of preventive measures introduced at 6 months of age on those identified as being at risk of growth faltering at 3 years of age.",
136. Indoor Air. 2020 Mar;30(2):264-274. doi: 10.1111/ina.12627. Epub 2019 Dec 6.,Association of solid fuel use with risk of stunting in children living in China.,"Liang W(1), Wang B(1), Shen G(2), Cao S(1), Mcswain B(1), Qin N(1), Zhao L(3), 
Yu D(3), Gong J(4), Zhao S(5), Zhang Y(6), Duan X(1).","Author information:
(1)School of Energy and Environmental Engineering, University of Science and 
Technology, Beijing, China.
(2)College of Urban and Environmental Sciences, Peking university, Beijing, 
China.
(3)National Institute for Nutrition and Health, Chinese Center for Disease 
Control and Prevention, Beijing, China.
(4)BIC-ESAT and SKL-ESPC, College of Environmental Science and Engineering, 
Peking university, Beijing, China.
(5)Biostatistics and Computational Biology Branch, National Institute of 
Environmental Health Sciences, Durham, NC, USA.
(6)Department of Environmental Health Sciences, Yale School of Public Health, 
Yale University, New Haven, CT, USA.","Stunting adversely affects physical and mental outcomes of children. It has not 
been examined whether household air pollution from solid fuel combustion is a 
risk factor for stunting in children. In a total of 41,439 children aged 6-17 
across China, height was measured using a unified protocol. Multivariable linear 
regression models and logistic regression models were used to assess the 
associations of solid fuel use for cooking/heating with stunting in children. 
Adjusted for covariates, cooking/heating with solid fuel was significantly 
associated with a lower z-score for height for age and sex (β = -0.21 [-0.32 to 
-0.09] and -0.17 [-0.31 to -0.03], respectively) and an increased risk of 
stunting with an estimated ORs of 1.34 [1.07~1.68] and 1.37 [1.02~1.83], 
respectively. The risk of stunting associated with solid fuel use was 
statistically significant in high-age children. And the effect was greater on 
girls than on boys, though the difference was not statistically significant. Our 
study suggested that Chinese children living in households using solid fuel had 
a significantly higher risk of stunting than those living in households using 
cleaner fuel.",
"137. Pediatric Health Med Ther. 2019 Oct 25;10:115-130. doi:
10.2147/PHMT.S222198.  eCollection 2019.","Risk Factors Of Stunting Among Children Under 5 Years Of Age In The Eastern And 
Western Provinces Of Rwanda: Analysis Of Rwanda Demographic And Health Survey 
2014/2015.","Habimana S(1), Biracyaza E(2).","Author information:
(1)Rwanda Resilience and Grounding Organization (RRGO), Kigali, Rwanda.
(2)Department of Community Health, School of Public Health, College of Medicine 
and Health Sciences, University of Rwanda, Kigali, Rwanda.","BACKGROUND: Stunting is one of the most public health burdens in Rwanda. Most 
deaths due to stunting are associated with inappropriate feeding practices that 
occur in the first 5 years of life. This study aimed at determining the risk 
factors for stunting in children under 5 years of age in the Eastern and Western 
provinces of Rwanda.
METHOD: Cross-sectional study using secondary data from Rwanda Demographic 
Health Survey 2014/2015.
RESULTS: Stunting was highly prevalent in eastern province compared to Western 
province. It was also highly prevalent in rural area in both provinces. Results 
indicated a significant association between maternal education and stunting 
(=6.868; p=0.001), maternal age group (=15.44; p=0.017), maternal occupation 
(=30.012; p=0.000), wealth index (=14.327; p=0.006), sex of child (=2.91; 
p=0.008) and giving child fortified food (=4.256; p=0.039). Results indicated 
that antenatal care visits were significantly associated with stunting (=6.653; 
p=0.01). Sharing a toilet was significantly associated with stunting (=25.88; 
p=0.000). Multiple logistic regression indicated that the gender of child 
[OR=1.08; 95% CI (1.057-1.093), p=0.008], household wealth index [OR=0.386; 95% 
CI (0.357-0.414)] and breastfeeding [OR=0.02; 95% CI (0.004-0.036), p=0.013] 
were the risk factors of stunting in eastern and western provinces.
CONCLUSION: Immediate and appropriate interventions targeted at community 
management of acute malnutrition and stunting are needed to manage the 
associated morbidity and mortality. Strengthening the health system for 
improving child health through prioritizing maternal and child by addressing 
poverty and increase food access is mostly needed. These tactics yield more 
sustainable improvement in child nutrition within Eastern and Western provinces.",
"138. Adv Parasitol. 2019;106:171-208. doi: 10.1016/bs.apar.2019.07.004. Epub 2019
Aug  1.",Recent insights into innate and adaptive immune responses to Giardia.,"Singer SM(1), Fink MY(2), Angelova VV(2).","Author information:
(1)Department of Biology, Georgetown University, Washington, DC, United States. 
Electronic address: steven.singer@georgetown.edu.
(2)Department of Biology, Georgetown University, Washington, DC, United States.","Infection with Giardia produces a wide range of clinical outcomes. Acutely 
infected patients may have no overt symptoms or suffer from severe cramps, 
diarrhea, nausea and even urticaria. Recently, post-infectious irritable bowel 
syndrome and chronic fatigue syndrome have been identified as long-term sequelae 
of giardiasis. Frequently, recurrent and chronic Giardia infection is considered 
a major contributor to stunting in children from low and middle income 
countries. Perhaps the most unusual outcome of infection with Giardia is the 
apparent reduced risk of developing moderate-to-severe diarrhea due to other 
enteric infections which has been noted in several recent studies. The goal of 
understanding immune responses against Giardia is therefore to identify 
protective mechanisms which could become targets for vaccine development, but 
also to identify mechanisms whereby infections lead to these other diverse 
outcomes. Giardia induces a robust adaptive immune response in both humans and 
animals. It has been known for many years that there is production of large 
amounts of parasite-specific IgA following infection and that CD4+ T cell 
responses contribute to this IgA production and control of the infection. In the 
past decade, there have been advances in our understanding of the non-antibody 
effector mechanisms used by the host to fight Giardia infections, in particular 
the importance of the cytokine interleukin (IL)-17 in orchestrating these 
responses. There have also been major advances in understanding how the innate 
response to Giardia infection is initiated and how it contributes to the 
development of adaptive immunity. Finally, there here have been significant 
increases in our knowledge of how the resident microbial community influences 
the immune response and how these responses contribute to the development of 
some of the symptoms of giardiasis. In this article, we will focus on data 
generated in the last 10 years and how it has advanced our knowledge about this 
important parasitic disease.",
139. Int J Equity Health. 2019 Oct 15;18(1):156. doi: 10.1186/s12939-019-1046-7.,"Trends in socioeconomic inequalities in stunting prevalence in Latin America and 
the Caribbean countries: differences between quintiles and deciles.","Flores-Quispe MDP(1)(2), Restrepo-Méndez MC(3)(4), Maia MFS(3)(5), Ferreira 
LZ(3)(6), Wehrmeister FC(3)(6).","Author information:
(1)International Center for Equity in Health, Federal University of Pelotas, Rua 
Marechal Deodoro, 1160 3° Andar, Pelotas, RS, 96020-220, Brazil. 
mariadelpilarfloresq@hotmail.com.
(2)Post-graduate program in Epidemiology, Federal University of Pelotas, Rua 
Marechal Deodoro, 1160 3° Andar, Pelotas, RS, 96020-220, Brazil. 
mariadelpilarfloresq@hotmail.com.
(3)International Center for Equity in Health, Federal University of Pelotas, Rua 
Marechal Deodoro, 1160 3° Andar, Pelotas, RS, 96020-220, Brazil.
(4)MRC Integrative Epidemiology Unit, Population Health Sciences, University of 
Bristol, Bristol, UK.
(5)Federal University of Rio Grande, Av. Italia, s/n -Km 8-Carreiros, Rio 
Grande-RS, Brazil.
(6)Post-graduate program in Epidemiology, Federal University of Pelotas, Rua 
Marechal Deodoro, 1160 3° Andar, Pelotas, RS, 96020-220, Brazil.","BACKGROUND: With the adoption of the Sustainable Development Goals (SDGs), there 
is a renewed commitment of tackling the varied challenges of undernutrition, 
particularly stunting (SDG 2.2). Health equity is also a priority in the SDG 
agenda and there is an urgent need for disaggregated analyses to identify 
disadvantaged subgroups. We compared time trends in socioeconomic inequalities 
obtained through stratification by wealth quintiles and deciles for stunting 
prevalence.
METHODS: We used 37 representative Demographic and Health Surveys and Multiple 
Indicator Cluster surveys from nine Latin American and Caribbean (LAC) countries 
conducted between 1996 and 2016. Stunting in children under-5 years was assessed 
according to the 2006 WHO Child Growth Standards and stratified by wealth 
quintiles and deciles. Within-country socioeconomic inequalities were measured 
through concentration index (CIX) and slope index of inequality (SII). We used 
variance-weighted least squares regression to estimate annual changes.
RESULTS: Eight out of nine countries showed a statistical evidence of reduction 
in stunting prevalence over time. Differences between extreme deciles were 
larger than between quintiles in most of countries and at every point in time. 
However, when using summary measures of inequality, there were no differences in 
the estimates of SII with the use of deciles and quintiles. In absolute terms, 
there was a reduction in socioeconomic inequalities in Peru, Honduras, Dominican 
Republic, Belize, Suriname and Colombia. In relative terms, there was an 
increase in socioeconomic inequalities in Peru, Bolivia, Haiti, Honduras and 
Guatemala.
CONCLUSIONS: LAC countries have made substantial progress in terms of reducing 
stunting,. Nevertheless, renewed actions are needed to improve equity. 
Particularly in those countries were absolute and relative inequalities did not 
change over time such Bolivia and Guatemala. Finer breakdowns in wealth 
distribution are expected to elucidate more differences between subgroups; 
however, this approach is relevant to cast light on those subgroups that are 
still lagging behind within populations and inform equity-oriented health 
programs and practices.",
"140. PLoS One. 2019 Aug 23;14(8):e0221095. doi: 10.1371/journal.pone.0221095. 
eCollection 2019.","Pathobiome driven gut inflammation in Pakistani children with Environmental 
Enteric Dysfunction.","Iqbal NT(1)(2), Syed S(1)(3), Kabir F(1), Jamil Z(2), Akhund T(1), Qureshi S(1), 
Liu J(4), Ma JZ(4), Guleria S(3), Gewirtz A(5), Duggan CP(6)(7), Hughes MA(4), 
Sadiq K(1), Ali A(1).","Author information:
(1)Department of Pediatrics and Child Health, Aga Khan University, Karachi, 
Pakistan.
(2)Department of Biological & Biomedical Sciences, Aga Khan University, Karachi, 
Pakistan.
(3)Department of Pediatrics, University of Virginia, Charlottesville, VA, United 
States of America.
(4)Department of Medicine, University of Virginia, Charlottesville, VA, United 
States of America.
(5)Center for Inflammation Immunity & Infection, Georgia State University, 
Atlanta, Georgia, United States of America.
(6)Division of Gastroenterology, Hepatology and Nutrition, Boston Children's 
Hospital, Boston, Massachusetts, United States of America.
(7)Departments of Global Health and Population, and Nutrition, Harvard T.H. Chan 
School of Public Health, Boston, Massachusetts, United States of America.","Environmental Enteric Dysfunction (EED) is an acquired small intestinal 
inflammatory condition underlying high rates of stunting in children <5 years of 
age in low- and middle-income countries. Children with EED are known to have 
repeated exposures to enteropathogens and environmental toxins that leads to 
malabsorptive syndrome. We aimed to characterize association of linear growth 
faltering with enteropathogen burden and subsequent changes in EED biomarkers. 
In a longitudinal birth cohort (n = 272), monthly anthropometric measurements 
(Length for Age Z score- LAZ) of asymptomatic children were obtained up to 18 
months. Biological samples were collected at 6 and 9 months for the assessment 
of biomarkers. A customized TaqMan array card was used to target 40 
enteropathogens in fecal samples. Linear regression was applied to study the 
effect of specific enteropathogen infection on change in linear growth (ΔLAZ). 
Presence of any pathogen in fecal sample correlated with serum flagellin IgA (6 
mo, r = 0.19, p = 0.002), fecal Reg 1b (6 mo, r = 0.16, p = 0.01; 9mo, r = 0.16, 
p = 0.008) and serum Reg 1b (6 mo, r = 0.26, p<0.0001; 9 mo, r = 0.15, p = 
0.008). At 6 months, presence of Campylobacter [β (SE) 7751.2 (2608.5), p = 
0.003] and ETEC LT [β (SE) 7089.2 (3015.04), p = 0.019] was associated with 
increase in MPO. Giardia was associated with increase in Reg1b [β (SE) 72.189 
(26.394), p = 0.006] and anti-flic IgA[β (SE) 0.054 (0.021), p = 0.0091]. 
Multiple enteropathogen infections in early life negatively correlated with 
ΔLAZ, and simultaneous changes in gut inflammatory and permeability markers. A 
combination vaccine targeting enteropathogens in early life could help in the 
prevention of future stunting.",
